Question,Answer
What are the fees associated with MTN MoMo transactions?,"The fees for MTN MoMo transactions depend on the amount being transferred and the type of transaction. The fees are generally affordable, and you can view the specific rates for sending and receiving money through MoMo on their website."
"What is MTN Callertunez, and how can I set it for my phone?","MTN Callertunez allows you to set a personalized song or tune as your caller ringtone, replacing the standard ringing sound for people calling you. You can choose a song from a wide variety available."
How can I deactivate MTN Callertunez?,"To deactivate MTN Callertunez, dial 4104# and follow the prompts. You can also manage your Callertunez subscription using the myMTN App."
"What is the MTN Data Save feature, and how does it help me use less data?",MTN Data Save helps reduce data consumption by compressing websites and apps that use high data. It can save you up to 50% on your regular data usage without compromising your browsing experience.
How do I activate the MTN Data Save feature?,"To activate MTN Data Save, go to the myMTN App, select the ""Data Save"" feature, and follow the prompts to enable it. Alternatively, you can dial 1314# to activate it from your phone."
"What is MTNs Family and Friends (F&F) service, and how does it work?","MTNs Family and Friends service allows you to designate specific numbers as family and friends, so that calls to those numbers are cheaper. You can save on call costs to the selected numbers on your list."
How do I add numbers to my MTN Family and Friends list?,"To add a number to your F&F list, dial 1312#, select ""Add Number,"" and enter the number you want to add. You can also use the myMTN App to manage your list."
How can I remove a number from my MTN Family and Friends list?,"To remove a number, dial 1312# and select ""Remove Number."" You can also access this feature in the myMTN App, where you can delete numbers you no longer wish to include in your list."
"What is MTNs PayGo (Pay-As-You-Go) plan, and how does it work?","MTNs PayGo plan is a prepaid plan where you pay for the services you use in real-time. This means you are charged based on your calls, data, and other services as you use them, with no need to commit to a long-term plan."
How do I switch to the MTN PayGo plan?,"To switch to the MTN PayGo plan, simply dial *131# and follow the prompts to choose the PayGo option. You will be charged for services based on your actual usage."
"What is MTNs Call Me Back feature, and how does it help when Im low on balance?","The Call Me Back feature allows you to send a message to another MTN user requesting them to call you back, especially when your balance is insufficient to make calls. The message will be free of charge."
How do I use MTNs Call Me Back feature?,Dial *133# to send a Call Me Back request to another MTN user. The recipient will receive a notification to call you back.
How can I check my MTN account balance for airtime and data?,"To check your MTN account balance, dial *131# for airtime balance and 1314# for data balance. You can also use the myMTN App to monitor your balance in real-time."
"What is the MTN Emergency Credit service, and how does it help in times of low balance?",The MTN Emergency Credit service provides users with a small loan of airtime when they have no balance left. It allows you to make calls and send messages until you can top up again.
How do I activate MTN Emergency Credit?,"Dial *606# to activate MTN Emergency Credit. Depending on your account history and balance, you can borrow a small amount of airtime to use for emergency calls or messages."
"What are MTNs Postpaid plans, and how do they differ from prepaid?","MTNs Postpaid plans allow users to pay for their services at the end of the month rather than in advance. These plans typically offer more flexible data, call minutes, and SMS allowances, which are billed monthly."
How can I switch from a prepaid to a postpaid MTN plan?,"To switch from prepaid to postpaid, visit any MTN store or use the myMTN App. You will need to provide necessary documentation such as ID and proof of address."
"What is MTNs Free Wi-Fi service, and where can I use it?","MTNs Free Wi-Fi service is available in select public places such as malls, airports, and shopping centers. Users can connect to the Wi-Fi network for free and enjoy fast internet for a limited time."
How can I find MTN Free Wi-Fi hotspots near me?,"You can find MTN Free Wi-Fi hotspots using the myMTN App, which shows the nearest locations where you can access free Wi-Fi. You can also visit MTN's website for more information on their free Wi-Fi services."
"What is the MTN SafetyNet, and how does it protect my mobile device?","MTN SafetyNet is a service that protects your mobile phone from viruses, malware, and other online threats. It also includes a device tracker and remote lock features to help keep your phone safe."
How do I activate MTN SafetyNet?,"To activate MTN SafetyNet, dial 1313# or download the MTN SafetyNet App from your devices app store. The service provides security features to protect your phone from potential risks."
What is MTN Group?,MTN Group is a multinational telecommunications company headquartered in South Africa. It provides mobile network services across 20+ countries.
What countries does MTN operate in?,"MTN operates in over 20 countries, mostly in Africa and the Middle East, including Nigeria, South Africa, and Ghana."
How many subscribers does MTN have?,"MTN has over 289 million subscribers as of 2022, making it the largest mobile network provider in Africa."
What services does MTN offer?,"MTN offers mobile networks, data services, mobile money, digital services, and other telecom-related services."
How can I contact MTN customer service?,"You can contact MTN customer service by calling 180 (from an MTN line), using their myMTN app, or visiting a local MTN store."
What is the MTN data network?,"MTN provides 2G, 3G, 4G, and 5G mobile data networks, depending on the region and infrastructure available."
Does MTN offer mobile money services?,"Yes, MTN offers mobile money services through MTN MoMo in several countries, enabling users to transfer money, pay bills, and more."
How can I check my MTN data balance?,Dial *131# or use the myMTN app to check your data balance.
How can I subscribe to MTNs data bundles?,You can subscribe to MTNs data bundles via USSD by dialing *321# or using the myMTN app.
How can I buy MTN airtime?,"You can buy airtime through USSD (*555#), the myMTN app, or visit authorized vendors and retail outlets."
What is MTN's coverage in rural areas?,"MTN is expanding its network in rural areas to improve coverage, focusing on providing internet and mobile connectivity."
What is MTN's role in corporate social responsibility?,"MTN focuses on education, health, and environmental initiatives, investing in various social projects across Africa."
How do I get an MTN SIM card?,"You can get an MTN SIM card by visiting an MTN store or authorized retailer, ensuring that you provide valid ID for registration."
How do I check my MTN call history?,"Dial *131# to access call history, or use the myMTN app for detailed records."
What is MTNs partnership with PayPal?,MTN has partnered with PayPal to enable users to link their MTN accounts for easier mobile payment and e-commerce transactions.
How can I activate MTN SafetyNet?,Dial 1313# to activate MTN SafetyNet for mobile security features such as malware protection and device tracking.
How do I unsubscribe from MTNs subscription services?,You can unsubscribe from MTNs subscription services by dialing *141# or following the instructions in the myMTN app.
What is MTNs coverage in urban areas?,"MTN offers extensive coverage in urban areas, with strong 4G and 5G networks in major cities across its operating countries."
How can I transfer airtime to someone on MTN?,"To transfer airtime to another MTN number, dial *777# and follow the prompts to complete the transfer."
What is MTN's policy on data rollover?,"MTN allows unused data from certain plans to roll over for a limited time, ensuring that you can use your remaining data in the next month."
How do I check my MTN data balance?,"You can check your MTN data balance by dialing *131# from your MTN line. Alternatively, you can use the myMTN app for a detailed view of your data usage."
How do I activate MTN's data bundles?,"To activate MTN data bundles, dial *321# or *904# for different options. You can also use the myMTN app or SMS to subscribe to the available bundles."
What are the available MTN data bundles?,"MTN offers a variety of data bundles, including daily, weekly, and monthly plans, with options for social media, video streaming, and general internet browsing."
How can I transfer data to another MTN user?,You can transfer data to another MTN number by dialing 1312# and selecting the amount of data you wish to send. The recipient will receive the data instantly.
How can I check my MTN airtime balance?,"To check your airtime balance, simply dial *556# or use the myMTN app to view both your airtime and data balance in real time."
How do I purchase MTN airtime online?,"You can purchase airtime online through various platforms, including the myMTN app, your bank's mobile app, or third-party websites like Paystack and Flutterwave."
What is MTNs mobile money service?,"MTN offers mobile money services through MTN MoMo, allowing users to send and receive money, pay bills, and perform other financial transactions directly from their mobile phones."
How do I activate MTN MoMo on my phone?,"To activate MTN MoMo, dial *365# and follow the prompts to register your MoMo account. You will need to provide some personal details and set a PIN for security."
What is MTNs 4G LTE service?,"MTN's 4G LTE service provides high-speed mobile internet with faster download and upload speeds, allowing for better streaming, browsing, and gaming experiences on compatible devices."
How do I enable MTN 4G LTE on my phone?,"To enable MTN 4G LTE, ensure that your device supports 4G and that you are in an area with 4G coverage. Then, enable 4G in your phones network settings."
How can I track my MTN data usage?,"You can track your data usage by dialing 1314# or using the myMTN app, which provides real-time updates on your data consumption."
What is MTNs mobile hotspot service?,"MTN offers mobile hotspot devices that allow users to connect multiple devices to the internet by sharing a 3G or 4G data connection, offering convenient internet access on the go."
How can I set up a mobile hotspot on MTN?,"To set up a mobile hotspot on MTN, go to your devices settings, enable the hotspot feature, and configure it to share your MTN mobile data."
What is MTN's Wi-Fi service?,"MTN offers Wi-Fi services in select locations, providing fast internet access in public places like shopping malls, airports, and cafes. You can access it through the MTN Wi-Fi network."
How do I connect to MTN Wi-Fi?,"To connect to MTN Wi-Fi, search for available MTN Wi-Fi hotspots in your area and select the network. You may need to log in or get an access code through the myMTN app."
What is MTN's call forwarding feature?,"MTNs call forwarding service allows users to redirect incoming calls to another number, either when the line is busy, unanswered, or unreachable. Dial 21 followed by the number to activate it."
How can I activate MTN call forwarding?,"To activate call forwarding, dial 21 followed by the number you wish to forward your calls to. To deactivate, dial #21#."
What is MTNs international roaming service?,"MTN offers international roaming services that allow you to use your MTN number while traveling abroad, with voice, SMS, and data services available in over 160 countries."
How do I activate MTN international roaming?,"To activate MTNs international roaming, dial *567# or contact MTN customer service before traveling to ensure your roaming is set up."
What is MTNs Wi-Fi Calling service?,"MTN Wi-Fi Calling allows you to make calls over a Wi-Fi network instead of a mobile network, which can be useful in areas with poor mobile signal but good internet coverage."
How do I enable MTN Wi-Fi Calling on my phone?,"To enable Wi-Fi Calling, go to your phones settings and turn on Wi-Fi calling under the mobile network settings if your device and plan support this feature."
How can I block unwanted calls on MTN?,You can block unwanted calls by activating the call barring feature or by using third-party apps to blacklist specific numbers on your MTN line.
How do I activate call barring on MTN?,"To activate call barring, dial 35 followed by your desired barring type (e.g., incoming, outgoing) and then the number you wish to block."
What is MTNs value-added services (VAS)?,"MTNs value-added services include subscription-based services for music, games, education, and entertainment, allowing customers to access additional content and perks."
How do I subscribe to MTN's value-added services?,"You can subscribe to MTNs VAS by dialing specific USSD codes for services such as MTN Music+, MTN Play, or by sending keywords to 312."
How do I cancel MTN subscription services?,"To cancel a subscription service, dial *141# and follow the prompts to unsubscribe from any active subscriptions. You can also manage services via the myMTN app."
How can I check if my MTN SIM card is registered?,"To check if your MTN SIM card is registered, dial *789# or visit any MTN store with a valid ID for verification and registration if necessary."
How do I update my MTN SIM registration details?,"To update your SIM registration details, visit an MTN store with your identification document for the necessary changes to be made."
"What is MTNs security service, SafetyNet?","MTN SafetyNet is a service that offers protection against malware, viruses, and other mobile security threats, including device tracking and remote lock capabilities."
How do I activate MTN SafetyNet?,"Dial 1313# to activate MTN SafetyNet, or download the MTN SafetyNet app from your devices app store to activate and set up mobile security."
"What is MTNs ""Free Wi-Fi"" offer?","MTNs Free Wi-Fi offer gives customers access to free Wi-Fi in select public areas for a limited period, allowing users to browse the internet without data charges."
How do I access MTNs Free Wi-Fi?,"To access MTNs Free Wi-Fi, find an MTN Wi-Fi hotspot location, connect to the network, and enjoy free internet for a limited time based on the location and terms."
What is MTNs customer loyalty program?,"MTN has a customer loyalty program that rewards long-term customers with discounts, special offers, and exclusive services based on usage and engagement."
How can I participate in MTN's loyalty program?,"You can participate in MTNs loyalty program by accumulating points through continued usage of MTN services. The more points you collect, the better the rewards."
How do I reset my MTN PIN?,"To reset your MTN PIN, dial 1216# and follow the prompts to securely reset your PIN for account protection."
How do I access MTNs mobile internet on my laptop?,"To access MTNs mobile internet on your laptop, you can use an MTN mobile hotspot or USB modem to connect your laptop to MTN's data network."
What is MTNs SIM swap policy?,"MTN allows users to swap their SIM cards in case of loss, theft, or damage. You must visit an MTN store with valid identification to complete the swap process."
How do I perform a SIM swap on MTN?,"To perform a SIM swap, visit an MTN service center with a valid ID and fill out the required forms to swap your SIM card for a new one."
How does MTNs e-commerce service work?,"MTNs e-commerce service includes platforms where users can purchase goods and services, ranging from electronics to digital content, using MTNs mobile money or airtime."
How do I pay for goods through MTNs e-commerce platform?,"To pay for goods via MTNs e-commerce platform, you can use MTN MoMo, mobile airtime, or bank card depending on the vendors payment options."
"What is MTN's ""Digital Services"" offering?","MTN's Digital Services include mobile banking, entertainment, streaming, gaming, and education content, designed to provide customers with more value through mobile technology."
How do I subscribe to MTNs Digital Services?,"To subscribe to MTNs Digital Services, you can visit their digital content platform or dial specific USSD codes for services like music, movies, and educational content."
How can I register my SIM card in Nigeria?,"To register a SIM card in Nigeria, you need to provide your National Identification Number (NIN), along with biometric information (fingerprint and face capture) at an authorized registration center."
What is the National Identification Number (NIN)?,The National Identification Number (NIN) is a unique identification number assigned to Nigerian citizens by the National Identity Management Commission (NIMC) for national security and identity purposes.
How do I link my NIN to my MTN SIM?,"To link your NIN to your MTN SIM, dial *785# and follow the prompts to provide your NIN details. Alternatively, visit an MTN center for manual registration."
What documents are needed for SIM registration in Nigeria?,"For SIM registration in Nigeria, you need a valid NIN, a form of identification (e.g., passport, drivers license), and biometric details (fingerprint and face capture)."
What happens if my NIN is not linked to my SIM card?,"If your NIN is not linked to your SIM card, you risk having your number deactivated, as the Nigerian government has mandated all SIM cards to be linked to the NIN."
How can I perform a SIM swap?,"To perform a SIM swap, visit an MTN service center with a valid form of ID. You will need to fill out a form and provide details for the swap."
What is SIM swapping?,"SIM swapping refers to the process of replacing your old SIM card with a new one, typically when your old SIM is lost, damaged, or stolen."
How do I retrieve a lost or stolen MTN SIM card?,"To retrieve a lost or stolen MTN SIM card, visit an MTN service center with valid ID and request a replacement SIM. You may need to provide proof of ownership."
How do I upgrade my SIM card to 4G?,"To upgrade your SIM card to 4G, visit an MTN store or use the MTN app, providing your valid ID and requesting a 4G-compatible SIM."
What is a SIM card upgrade?,A SIM card upgrade refers to moving from a 3G SIM to a 4G or 5G-compatible SIM to enjoy faster internet speeds and enhanced services.
Can I perform a SIM upgrade online?,"You can request a SIM upgrade online by visiting MTNs website or using their mobile app, though you may need to visit an MTN store for verification and to collect your new SIM."
How do I know if my SIM is compatible with 4G?,"To know if your SIM is 4G compatible, check the SIM card packaging or visit an MTN store for a compatibility check. Additionally, dial 1314# to check for 4G availability in your area."
What is the process for SIM card registration in Nigeria?,"SIM card registration in Nigeria requires providing a valid NIN, biometric data (fingerprints and facial recognition), and a valid ID card, which must be done at authorized centers."
How do I link my NIN to my MTN account?,"To link your NIN to your MTN account, dial *785#, or visit the MTN website or app to link your details. Ensure your NIN is updated in the National Identity Database."
How can I check if my NIN is linked to my SIM?,You can check if your NIN is linked to your MTN SIM by dialing 7851# or visiting an MTN service center for assistance.
What happens if my SIM is not registered or linked to NIN?,"If your SIM is not registered or linked to NIN, it may be deactivated by the Nigerian Communications Commission (NCC) as part of the government's NIN-SIM linkage policy."
Can I register a new SIM without an NIN?,"No, according to Nigerian law, it is now mandatory to provide an NIN for SIM registration, and this requirement is enforced by the NCC."
What should I do if I forget my SIM card PIN?,"If you forget your SIM card PIN, you can unblock it by entering the PUK (Personal Unblocking Key) code, which is usually provided with your SIM card packaging or by contacting MTN customer service."
How do I block a SIM card if its lost or stolen?,"To block a lost or stolen MTN SIM card, contact MTN customer service by dialing 180 and request that they block your SIM to prevent unauthorized use."
How can I deactivate my MTN SIM card?,"To deactivate your MTN SIM card, you must contact MTN customer service to request a deactivation or visit an MTN store for assistance."
What is the MTN SIM replacement policy?,"MTN allows SIM replacements due to loss, damage, or theft. You will need to provide valid identification and possibly fill out a form at a service center for a replacement."
How can I upgrade my SIM to 5G on MTN?,"To upgrade your SIM to 5G, visit an MTN store with valid identification, and the staff will assist you in swapping your SIM for a 5G-compatible one."
Can I upgrade my SIM online to 5G?,"Currently, SIM upgrades to 5G are available at physical MTN stores. You may contact MTN customer service for more details on how to request an upgrade."
What happens if my SIM is blocked for not linking NIN?,"If your SIM is blocked due to not linking your NIN, you will need to visit an MTN store to provide your NIN and get your SIM reactivated."
How long does it take to link my NIN to my SIM?,The NIN linking process is usually quick and can be done within a few minutes by dialing *785# or visiting an MTN store.
Can I change my SIM card number?,"Yes, you can request a SIM number change by visiting an MTN service center with your ID and completing the necessary form for a new number."
How do I retrieve my NIN if Ive forgotten it?,"If you forget your NIN, you can retrieve it by visiting the NIMC website or contacting their support for assistance."
How can I update my NIN information with MTN?,"To update your NIN information with MTN, visit an MTN store with your NIN slip and request an update to your registered details."
What is MTNs SIM card registration process for foreigners?,"Foreigners can register an MTN SIM card by providing their passport, visa, or residence permit, along with a valid NIN and biometric data at an authorized MTN registration center."
How do I perform an international SIM swap?,"For international SIM swaps, contact MTN customer service or visit an MTN store to request a swap while ensuring that you provide valid identification and proof of ownership."
How do I activate my new MTN SIM card?,"After swapping or receiving a new SIM card, insert it into your phone and dial *123# to activate it. You may also need to enter a PIN for activation."
Can I use my MTN SIM in another device after activation?,"Yes, you can use your MTN SIM in any unlocked device after activation. Just ensure the device supports the network frequency of MTN."
What are the benefits of SIM registration in Nigeria?,"SIM registration helps in identifying subscribers, improving national security, preventing fraud, and complying with the governments policies."
How do I know if my MTN SIM has been activated?,"Once you have inserted your SIM into your phone and dialed *123# or *131#, your MTN SIM will be activated if you receive a response."
How can I retrieve my MTN SIM PIN?,The PIN can be retrieved from your SIM packaging or by contacting MTN customer service if youve forgotten it.
Can I change my SIM PIN?,"Yes, you can change your SIM PIN by dialing *789# and following the instructions for PIN management. You will need to know your current PIN to make the change."
How do I transfer my MTN number to another network?,"To port your MTN number to another network, visit your desired networks customer service center, complete a form, and provide your MTN account details."
What should I do if my SIM is not working?,"If your SIM is not working, first check if your phone is compatible and supports the network. You may also need to check if your SIM is properly inserted or visit an MTN store."
How do I check if my SIM swap was successful?,You can check if your SIM swap was successful by dialing *123# to check if your old number is active or if your new SIM is working properly.
What should I do if my SIM is damaged?,"If your SIM card is damaged, visit an MTN store with a valid ID and request a replacement. You may also need to provide your NIN for verification."
How do I update my NIN details if there is a change?,"If you need to update your NIN, visit the nearest NIMC office, fill out the necessary form, and provide valid documents for the update."
How long does it take to link NIN to my MTN SIM?,Linking your NIN to your MTN SIM is usually completed within minutes by dialing *785# or visiting an MTN service center.
What happens if I dont update my NIN?,"If you dont update your NIN, you risk your SIM being deactivated, as all SIM cards in Nigeria must be linked to NIN according to government regulations."
Can I link multiple SIM cards to my NIN?,"Yes, you can link multiple SIM cards to your NIN, but each SIM card must be individually registered and linked to your NIN through the appropriate process."
How can I check the status of my NIN link to my MTN SIM?,"To check if your NIN is linked to your MTN SIM, dial 7851# or visit an MTN service center."
What happens if I use a SIM after it's been deactivated?,"If your SIM is deactivated, it will not work for making calls, sending messages, or accessing data until reactivation is done by linking the NIN or following the reactivation steps."
Can I reactivate my MTN SIM without visiting a service center?,"Yes, you can reactivate your MTN SIM by dialing *785#, but if you face difficulties, visiting an MTN store may be necessary for further assistance."
